{
  "schema_version": "1.1",
  "kind": "oss_fingerprint",
  "identity": {
    "canonical_name": "libxml2",
    "canonical_id": "pkg:libxml2",
    "aliases": [
      "textproc/libxml2"
    ]
  },
  "repository": {
    "url": null,
    "kind": null,
    "web": null,
    "confidence": 0.0,
    "source": null,
    "candidates": []
  },
  "license": {
    "spdx": [
      "MIT"
    ],
    "raw": [
      "MIT"
    ],
    "confidence": 0.9
  },
  "homepage": "http://xmlsoft.org/",
  "summary": "XML parser library for GNOME",
  "ecosystems": [
    {
      "ecosystem": "freebsd_ports",
      "ecosystem_id": "textproc/libxml2",
      "version": "2.15.4",
      "canonical_id": "pkg:libxml2"
    }
  ],
  "depends_on": [
    {
      "name": "find-xml-catalogs-hook",
      "scope": "runtime",
      "ecosystem": "freebsd_ports",
      "resolved": false
    },
    {
      "name": "pkg-config-wrapper",
      "scope": "build",
      "ecosystem": "freebsd_ports",
      "resolved": true,
      "resolved_to": "pkg-config-wrapper"
    },
    {
      "name": "autoreconf-hook",
      "scope": "build",
      "ecosystem": "freebsd_ports",
      "resolved": true,
      "resolved_to": "autoreconf-hook"
    }
  ],
  "evidence": {
    "recipes": [
      "specs/libxml2.json"
    ],
    "behavioral_spec": "zspecs/libxml2.zspec.zsdl",
    "recreation": "secondary"
  },
  "priority": {
    "primary": [
      "provenance",
      "tracking",
      "dependencies"
    ],
    "secondary": [
      "recreation"
    ]
  },
  "tracking": {
    "ingested_at": "2026-10-08T04:29:01+00:00",
    "recipe_count": 1,
    "maintainers": [
      "desktop@FreeBSD.org",
      "emulation@FreeBSD.org",
      "jtojnar",
      "gepbird"
    ],
    "categories": [
      "textproc",
      "gnome"
    ],
    "source_paths": [
      "textproc/libxml2"
    ],
    "source_repo_commits": [
      "7e6eb47aa71100bc6278d613df0743e2b1ddeaaf"
    ],
    "build_systems": [
      "freebsd_ports_make"
    ],
    "distributions": [
      {
        "type": "homepage",
        "url": "http://xmlsoft.org/"
      },
      {
        "type": "master_sites",
        "url": "GNOME"
      },
      {
        "type": "homepage",
        "url": "https://gitlab.gnome.org/GNOME/libxml2"
      }
    ],
    "dropped_dependencies": [],
    "dep_edges": 3,
    "dep_resolved": 2,
    "dep_dangling": 1
  },
  "provenance": {
    "generated_by": "theseus.fabric",
    "imported_at": "2026-10-08T04:28:46+00:00",
    "confidence": 0.95,
    "sources": [
      {
        "path": "specs/libxml2.json",
        "kind": "package_recipe",
        "imported_at": "2026-10-08T04:28:46+00:00",
        "generated_by": "refresh_recipes.py",
        "source_path": "textproc/libxml2",
        "source_repo_commit": "7e6eb47aa71100bc6278d613df0743e2b1ddeaaf",
        "confidence": 0.95,
        "unmapped": []
      }
    ],
    "warnings": [
      "partial refresh; kept prior data for: nixpkgs"
    ]
  }
}
