{
  "schema_version": "1.1",
  "kind": "oss_fingerprint",
  "identity": {
    "canonical_name": "raw-body",
    "canonical_id": "pkg:raw-body",
    "aliases": []
  },
  "repository": {
    "url": "https://github.com/stream-utils/raw-body",
    "kind": "git",
    "web": "https://github.com/stream-utils/raw-body",
    "confidence": 0.95,
    "source": "npm.source_repository",
    "candidates": []
  },
  "license": {
    "spdx": [
      "MIT"
    ],
    "raw": [
      "MIT"
    ],
    "confidence": 0.9
  },
  "homepage": "https://github.com/stream-utils/raw-body#readme",
  "summary": "Get and validate the raw body of a readable stream.",
  "ecosystems": [
    {
      "ecosystem": "npm",
      "ecosystem_id": "raw-body",
      "version": "4.0.0",
      "canonical_id": "pkg:raw-body"
    }
  ],
  "depends_on": [
    {
      "name": "bytes",
      "scope": "runtime",
      "ecosystem": "npm",
      "resolved": true,
      "resolved_to": "bytes"
    },
    {
      "name": "http-errors",
      "scope": "runtime",
      "ecosystem": "npm",
      "resolved": true,
      "resolved_to": "http-errors"
    },
    {
      "name": "eslint",
      "scope": "build",
      "ecosystem": "npm",
      "resolved": true,
      "resolved_to": "eslint"
    },
    {
      "name": "vitest",
      "scope": "build",
      "ecosystem": "npm",
      "resolved": false
    },
    {
      "name": "iconv-lite",
      "scope": "build",
      "ecosystem": "npm",
      "resolved": true,
      "resolved_to": "iconv-lite"
    },
    {
      "name": "size-limit",
      "scope": "build",
      "ecosystem": "npm",
      "resolved": false
    },
    {
      "name": "typescript",
      "scope": "build",
      "ecosystem": "npm",
      "resolved": true,
      "resolved_to": "typescript"
    },
    {
      "name": "@types/node",
      "scope": "build",
      "ecosystem": "npm",
      "resolved": true,
      "resolved_to": "types__node"
    },
    {
      "name": "neostandard",
      "scope": "build",
      "ecosystem": "npm",
      "resolved": false
    },
    {
      "name": "@types/bytes",
      "scope": "build",
      "ecosystem": "npm",
      "resolved": false
    },
    {
      "name": "@types/http-errors",
      "scope": "build",
      "ecosystem": "npm",
      "resolved": false
    },
    {
      "name": "@vitest/coverage-v8",
      "scope": "build",
      "ecosystem": "npm",
      "resolved": true,
      "resolved_to": "vitest__coverage-v8"
    },
    {
      "name": "@size-limit/preset-small-lib",
      "scope": "build",
      "ecosystem": "npm",
      "resolved": false
    }
  ],
  "evidence": {
    "recipes": [
      "specs/raw-body.json"
    ],
    "behavioral_spec": null,
    "recreation": "secondary"
  },
  "priority": {
    "primary": [
      "provenance",
      "tracking",
      "dependencies"
    ],
    "secondary": [
      "recreation"
    ]
  },
  "tracking": {
    "ingested_at": "2026-10-20T20:57:14+00:00",
    "recipe_count": 1,
    "maintainers": [
      "bjohansebas@gmail.com",
      "hello@blakeembrey.com",
      "doug@somethingdoug.com",
      "jonathanrichardong@gmail.com",
      "ljharb@gmail.com"
    ],
    "categories": [
      "javascript"
    ],
    "source_paths": [
      "https://registry.npmjs.org/raw-body"
    ],
    "source_repo_commits": [],
    "build_systems": [
      "npm"
    ],
    "distributions": [
      {
        "type": "tarball",
        "url": "https://registry.npmjs.org/raw-body/-/raw-body-4.0.0.tgz"
      }
    ],
    "dropped_dependencies": [],
    "dep_edges": 13,
    "dep_resolved": 7,
    "dep_dangling": 6
  },
  "provenance": {
    "generated_by": "theseus.fabric",
    "imported_at": "2026-10-08T04:28:50+00:00",
    "confidence": 0.85,
    "sources": [
      {
        "path": "specs/raw-body.json",
        "kind": "package_recipe",
        "imported_at": "2026-10-08T04:28:50+00:00",
        "generated_by": "refresh_recipes.py",
        "source_path": "https://registry.npmjs.org/raw-body",
        "source_repo_commit": null,
        "confidence": 0.85,
        "unmapped": []
      }
    ],
    "warnings": []
  }
}
