{
  "schema_version": "1.1",
  "kind": "oss_fingerprint",
  "identity": {
    "canonical_name": "anyio",
    "canonical_id": "pkg:anyio",
    "aliases": []
  },
  "repository": {
    "url": "https://github.com/agronholm/anyio",
    "kind": "git",
    "web": "https://github.com/agronholm/anyio",
    "confidence": 0.95,
    "source": "pypi.source_repository",
    "candidates": []
  },
  "license": {
    "spdx": [
      "MIT"
    ],
    "raw": [
      "MIT"
    ],
    "confidence": 0.9
  },
  "homepage": "https://anyio.readthedocs.io/en/latest/",
  "summary": "High-level concurrency and networking framework on top of asyncio or Trio",
  "ecosystems": [
    {
      "ecosystem": "pypi",
      "ecosystem_id": "anyio",
      "version": "4.15.1",
      "canonical_id": "pkg:anyio"
    }
  ],
  "depends_on": [
    {
      "name": "exceptiongroup",
      "scope": "runtime",
      "ecosystem": "pypi",
      "resolved": true,
      "resolved_to": "exceptiongroup"
    },
    {
      "name": "idna",
      "scope": "runtime",
      "ecosystem": "pypi",
      "resolved": true,
      "resolved_to": "idna"
    },
    {
      "name": "typing-extensions",
      "scope": "runtime",
      "ecosystem": "pypi",
      "resolved": true,
      "resolved_to": "typing-extensions"
    }
  ],
  "evidence": {
    "recipes": [
      "specs/anyio.json"
    ],
    "behavioral_spec": null,
    "recreation": "secondary"
  },
  "priority": {
    "primary": [
      "provenance",
      "tracking",
      "dependencies"
    ],
    "secondary": [
      "recreation"
    ]
  },
  "tracking": {
    "ingested_at": "2026-10-20T21:29:57+00:00",
    "recipe_count": 1,
    "maintainers": [
      "Alex Grönholm <alex.gronholm@nextday.fi>"
    ],
    "categories": [
      "python"
    ],
    "source_paths": [
      "https://pypi.org/pypi/anyio/json"
    ],
    "source_repo_commits": [],
    "build_systems": [
      "pypi"
    ],
    "distributions": [
      {
        "type": "sdist",
        "url": "https://files.pythonhosted.org/packages/a9/d2/f4d173e22df740bc37b1db102b386ba719b66e95b0f0d751f556b387e6d2/anyio-4.15.1.tar.gz",
        "sha256": "9f28306018cbd6d329e64a36d58256edff76dd996fe423bc957326e578b82a94"
      }
    ],
    "dropped_dependencies": [],
    "dep_edges": 3,
    "dep_resolved": 3,
    "dep_dangling": 0
  },
  "provenance": {
    "generated_by": "theseus.fabric",
    "imported_at": "2026-10-20T21:29:01+00:00",
    "confidence": 0.9,
    "sources": [
      {
        "path": "specs/anyio.json",
        "kind": "package_recipe",
        "imported_at": "2026-10-20T21:29:01+00:00",
        "generated_by": "refresh_recipes.py",
        "source_path": "https://pypi.org/pypi/anyio/json",
        "source_repo_commit": null,
        "confidence": 0.9,
        "unmapped": []
      }
    ],
    "warnings": [
      "Build requirements are unavailable from PyPI JSON metadata; no build dependencies inferred."
    ]
  }
}
