{
  "schema_version": "1.1",
  "kind": "oss_fingerprint",
  "identity": {
    "canonical_name": "scikit-learn",
    "canonical_id": "pkg:scikit-learn",
    "aliases": []
  },
  "repository": {
    "url": "https://github.com/scikit-learn/scikit-learn",
    "kind": "git",
    "web": "https://github.com/scikit-learn/scikit-learn",
    "confidence": 0.95,
    "source": "pypi.source_repository",
    "candidates": []
  },
  "license": {
    "spdx": [
      "BSD-3-Clause"
    ],
    "raw": [
      "BSD-3-Clause"
    ],
    "confidence": 0.9
  },
  "homepage": "https://scikit-learn.org",
  "summary": "A set of python modules for machine learning and data mining",
  "ecosystems": [
    {
      "ecosystem": "pypi",
      "ecosystem_id": "scikit-learn",
      "version": "1.9.1",
      "canonical_id": "pkg:scikit-learn"
    }
  ],
  "depends_on": [
    {
      "name": "numpy",
      "scope": "runtime",
      "ecosystem": "pypi",
      "resolved": true,
      "resolved_to": "numpy"
    },
    {
      "name": "scipy",
      "scope": "runtime",
      "ecosystem": "pypi",
      "resolved": true,
      "resolved_to": "scipy"
    },
    {
      "name": "joblib",
      "scope": "runtime",
      "ecosystem": "pypi",
      "resolved": false
    },
    {
      "name": "narwhals",
      "scope": "runtime",
      "ecosystem": "pypi",
      "resolved": false
    },
    {
      "name": "threadpoolctl",
      "scope": "runtime",
      "ecosystem": "pypi",
      "resolved": false
    }
  ],
  "evidence": {
    "recipes": [
      "specs/scikit-learn.json"
    ],
    "behavioral_spec": null,
    "recreation": "secondary"
  },
  "priority": {
    "primary": [
      "provenance",
      "tracking",
      "dependencies"
    ],
    "secondary": [
      "recreation"
    ]
  },
  "tracking": {
    "ingested_at": "2026-10-20T21:29:58+00:00",
    "recipe_count": 1,
    "maintainers": [
      "scikit-learn developers <scikit-learn@python.org>"
    ],
    "categories": [
      "python"
    ],
    "source_paths": [
      "https://pypi.org/pypi/scikit-learn/json"
    ],
    "source_repo_commits": [],
    "build_systems": [
      "pypi"
    ],
    "distributions": [
      {
        "type": "sdist",
        "url": "https://files.pythonhosted.org/packages/d2/eb/eaf5e07fcc0da7149b0e084f24e54edd7441b9a89ce7e034032ae97fe3a0/scikit_learn-1.9.1.tar.gz",
        "sha256": "629cada3e33e2b9bf376cdc7614a47a4140b8aedc1d836579e359736fbd82977"
      }
    ],
    "dropped_dependencies": [],
    "dep_edges": 5,
    "dep_resolved": 2,
    "dep_dangling": 3
  },
  "provenance": {
    "generated_by": "theseus.fabric",
    "imported_at": "2026-10-20T21:29:08+00:00",
    "confidence": 0.9,
    "sources": [
      {
        "path": "specs/scikit-learn.json",
        "kind": "package_recipe",
        "imported_at": "2026-10-20T21:29:08+00:00",
        "generated_by": "refresh_recipes.py",
        "source_path": "https://pypi.org/pypi/scikit-learn/json",
        "source_repo_commit": null,
        "confidence": 0.9,
        "unmapped": []
      }
    ],
    "warnings": [
      "Build requirements are unavailable from PyPI JSON metadata; no build dependencies inferred."
    ]
  }
}
