{
  "schema_version": "1.1",
  "kind": "oss_fingerprint",
  "identity": {
    "canonical_name": "pygments",
    "canonical_id": "pkg:pygments",
    "aliases": [
      "Pygments"
    ]
  },
  "repository": {
    "url": "https://github.com/pygments/pygments",
    "kind": "git",
    "web": "https://github.com/pygments/pygments",
    "confidence": 0.95,
    "source": "pypi.source_repository",
    "candidates": []
  },
  "license": {
    "spdx": [
      "BSD-2-Clause"
    ],
    "raw": [
      "BSD-2-Clause"
    ],
    "confidence": 0.9
  },
  "homepage": "https://pygments.org",
  "summary": "Pygments is a syntax highlighting package written in Python.",
  "ecosystems": [
    {
      "ecosystem": "pypi",
      "ecosystem_id": "Pygments",
      "version": "2.21.0",
      "canonical_id": "pkg:pygments"
    }
  ],
  "depends_on": [],
  "evidence": {
    "recipes": [
      "specs/pygments.json"
    ],
    "behavioral_spec": "zspecs/pygments.zspec.zsdl",
    "recreation": "secondary"
  },
  "priority": {
    "primary": [
      "provenance",
      "tracking",
      "dependencies"
    ],
    "secondary": [
      "recreation"
    ]
  },
  "tracking": {
    "ingested_at": "2026-10-20T21:29:58+00:00",
    "recipe_count": 1,
    "maintainers": [
      "Georg Brandl <georg@python.org>",
      "Jean Abou Samra <jean@abou-samra.fr>"
    ],
    "categories": [
      "python"
    ],
    "source_paths": [
      "https://pypi.org/pypi/Pygments/json"
    ],
    "source_repo_commits": [],
    "build_systems": [
      "pypi"
    ],
    "distributions": [
      {
        "type": "sdist",
        "url": "https://files.pythonhosted.org/packages/49/2e/ced460408999b33da6b31b0021b0f37d329e202d4169aeb164493778f25b/pygments-2.21.0.tar.gz",
        "sha256": "610ca751c9bc2492b38eb9a38a7fbc93edbbb2d7182edaf34e66ae493dee5c8c"
      }
    ],
    "dropped_dependencies": [],
    "dep_edges": 0,
    "dep_resolved": 0,
    "dep_dangling": 0
  },
  "provenance": {
    "generated_by": "theseus.fabric",
    "imported_at": "2026-10-20T21:29:06+00:00",
    "confidence": 0.9,
    "sources": [
      {
        "path": "specs/pygments.json",
        "kind": "package_recipe",
        "imported_at": "2026-10-20T21:29:06+00:00",
        "generated_by": "refresh_recipes.py",
        "source_path": "https://pypi.org/pypi/Pygments/json",
        "source_repo_commit": null,
        "confidence": 0.9,
        "unmapped": []
      }
    ],
    "warnings": [
      "Build requirements are unavailable from PyPI JSON metadata; no build dependencies inferred."
    ]
  }
}
