{
  "schema_version": "1.1",
  "kind": "oss_fingerprint",
  "identity": {
    "canonical_name": "markdown",
    "canonical_id": "pkg:markdown",
    "aliases": [
      "Markdown"
    ]
  },
  "repository": {
    "url": "https://github.com/Python-Markdown/markdown",
    "kind": "git",
    "web": "https://github.com/Python-Markdown/markdown",
    "confidence": 0.95,
    "source": "pypi.source_repository",
    "candidates": []
  },
  "license": {
    "spdx": [
      "BSD-3-Clause"
    ],
    "raw": [
      "BSD-3-Clause"
    ],
    "confidence": 0.9
  },
  "homepage": "https://Python-Markdown.github.io/",
  "summary": "Python implementation of John Gruber's Markdown.",
  "ecosystems": [
    {
      "ecosystem": "pypi",
      "ecosystem_id": "Markdown",
      "version": "3.11.2",
      "canonical_id": "pkg:markdown"
    }
  ],
  "depends_on": [],
  "evidence": {
    "recipes": [
      "specs/markdown.json"
    ],
    "behavioral_spec": "zspecs/markdown.zspec.zsdl",
    "recreation": "secondary"
  },
  "priority": {
    "primary": [
      "provenance",
      "tracking",
      "dependencies"
    ],
    "secondary": [
      "recreation"
    ]
  },
  "tracking": {
    "ingested_at": "2026-10-20T21:29:58+00:00",
    "recipe_count": 1,
    "maintainers": [
      "Waylan Limberg <python.markdown@gmail.com>"
    ],
    "categories": [
      "python"
    ],
    "source_paths": [
      "https://pypi.org/pypi/Markdown/json"
    ],
    "source_repo_commits": [],
    "build_systems": [
      "pypi"
    ],
    "distributions": [
      {
        "type": "sdist",
        "url": "https://files.pythonhosted.org/packages/f4/32/0b4d0297064244f04af4331b65de16237cc3cce07474171ee14222a28981/markdown-3.11.2.tar.gz",
        "sha256": "87bf5d90f2d2882e2c02fcda182c2800456b985bff38913867c49706481514b0"
      }
    ],
    "dropped_dependencies": [],
    "dep_edges": 0,
    "dep_resolved": 0,
    "dep_dangling": 0
  },
  "provenance": {
    "generated_by": "theseus.fabric",
    "imported_at": "2026-10-20T21:29:04+00:00",
    "confidence": 0.9,
    "sources": [
      {
        "path": "specs/markdown.json",
        "kind": "package_recipe",
        "imported_at": "2026-10-20T21:29:04+00:00",
        "generated_by": "refresh_recipes.py",
        "source_path": "https://pypi.org/pypi/Markdown/json",
        "source_repo_commit": null,
        "confidence": 0.9,
        "unmapped": []
      }
    ],
    "warnings": [
      "Build requirements are unavailable from PyPI JSON metadata; no build dependencies inferred."
    ]
  }
}
