{
  "schema_version": "1.1",
  "kind": "oss_fingerprint",
  "identity": {
    "canonical_name": "xorgproto",
    "canonical_id": "pkg:xorgproto",
    "aliases": [
      "x11/xorgproto"
    ]
  },
  "repository": {
    "url": null,
    "kind": null,
    "web": null,
    "confidence": 0.0,
    "source": null,
    "candidates": []
  },
  "license": {
    "spdx": [
      "MIT"
    ],
    "raw": [
      "MIT"
    ],
    "confidence": 0.9
  },
  "homepage": "https://gitlab.freedesktop.org/xorg/proto/xorgproto",
  "summary": "X Window System unified protocol definitions",
  "ecosystems": [
    {
      "ecosystem": "freebsd_ports",
      "ecosystem_id": "x11/xorgproto",
      "version": "2025.1",
      "canonical_id": "pkg:xorgproto"
    }
  ],
  "depends_on": [
    {
      "name": "pkg-config",
      "scope": "build",
      "ecosystem": "freebsd_ports",
      "resolved": false
    },
    {
      "name": "python3",
      "scope": "build",
      "ecosystem": "freebsd_ports",
      "resolved": true,
      "resolved_to": "python3"
    },
    {
      "name": "meson",
      "scope": "build",
      "ecosystem": "freebsd_ports",
      "resolved": true,
      "resolved_to": "meson"
    },
    {
      "name": "ninja",
      "scope": "build",
      "ecosystem": "freebsd_ports",
      "resolved": true,
      "resolved_to": "ninja"
    }
  ],
  "evidence": {
    "recipes": [
      "specs/xorgproto.json"
    ],
    "behavioral_spec": null,
    "recreation": "secondary"
  },
  "priority": {
    "primary": [
      "provenance",
      "tracking",
      "dependencies"
    ],
    "secondary": [
      "recreation"
    ]
  },
  "tracking": {
    "ingested_at": "2026-10-08T04:29:01+00:00",
    "recipe_count": 1,
    "maintainers": [
      "x11@FreeBSD.org"
    ],
    "categories": [
      "x11"
    ],
    "source_paths": [
      "x11/xorgproto"
    ],
    "source_repo_commits": [],
    "build_systems": [
      "freebsd_ports_make"
    ],
    "distributions": [
      {
        "type": "homepage",
        "url": "https://gitlab.freedesktop.org/xorg/proto/xorgproto"
      },
      {
        "type": "archive",
        "url": "mirror://xorg/individual/proto/xorgproto-${finalAttrs.version}.tar.xz"
      }
    ],
    "dropped_dependencies": [],
    "dep_edges": 4,
    "dep_resolved": 3,
    "dep_dangling": 1
  },
  "provenance": {
    "generated_by": "theseus.fabric",
    "imported_at": "2026-10-08T04:28:53+00:00",
    "confidence": 0.95,
    "sources": [
      {
        "path": "specs/xorgproto.json",
        "kind": "package_recipe",
        "imported_at": "2026-10-08T04:28:53+00:00",
        "generated_by": "refresh_recipes.py",
        "source_path": "x11/xorgproto",
        "source_repo_commit": null,
        "confidence": 0.95,
        "unmapped": []
      }
    ],
    "warnings": []
  }
}
