{
  "schema_version": "1.1",
  "kind": "oss_fingerprint",
  "identity": {
    "canonical_name": "oslo.utils",
    "canonical_id": "pkg:oslo.utils",
    "aliases": []
  },
  "repository": {
    "url": "https://opendev.org/openstack/oslo.utils",
    "kind": null,
    "web": "https://opendev.org/openstack/oslo.utils",
    "confidence": 0.95,
    "source": "pypi.source_repository",
    "candidates": []
  },
  "license": {
    "spdx": [
      "Apache-2.0"
    ],
    "raw": [
      "Apache-2.0"
    ],
    "confidence": 0.9
  },
  "homepage": "https://docs.openstack.org/oslo.utils",
  "summary": "Oslo Utility library",
  "ecosystems": [
    {
      "ecosystem": "pypi",
      "ecosystem_id": "oslo.utils",
      "version": "10.2.0",
      "canonical_id": "pkg:oslo.utils"
    }
  ],
  "depends_on": [
    {
      "name": "iso8601",
      "scope": "runtime",
      "ecosystem": "pypi",
      "resolved": true,
      "resolved_to": "iso8601"
    },
    {
      "name": "oslo.i18n",
      "scope": "runtime",
      "ecosystem": "pypi",
      "resolved": true,
      "resolved_to": "oslo.i18n"
    },
    {
      "name": "netaddr",
      "scope": "runtime",
      "ecosystem": "pypi",
      "resolved": true,
      "resolved_to": "netaddr"
    },
    {
      "name": "pyparsing",
      "scope": "runtime",
      "ecosystem": "pypi",
      "resolved": true,
      "resolved_to": "pyparsing"
    },
    {
      "name": "packaging",
      "scope": "runtime",
      "ecosystem": "pypi",
      "resolved": true,
      "resolved_to": "packaging"
    },
    {
      "name": "pyyaml",
      "scope": "runtime",
      "ecosystem": "pypi",
      "resolved": true,
      "resolved_to": "pyyaml"
    },
    {
      "name": "psutil",
      "scope": "runtime",
      "ecosystem": "pypi",
      "resolved": true,
      "resolved_to": "psutil"
    },
    {
      "name": "pbr",
      "scope": "runtime",
      "ecosystem": "pypi",
      "resolved": true,
      "resolved_to": "pbr"
    },
    {
      "name": "setuptools",
      "scope": "build",
      "ecosystem": "pypi",
      "resolved": true,
      "resolved_to": "setuptools"
    },
    {
      "name": "wheel",
      "scope": "build",
      "ecosystem": "pypi",
      "resolved": true,
      "resolved_to": "wheel"
    }
  ],
  "evidence": {
    "recipes": [
      "specs/oslo.utils.json"
    ],
    "behavioral_spec": null,
    "recreation": "secondary"
  },
  "priority": {
    "primary": [
      "provenance",
      "tracking",
      "dependencies"
    ],
    "secondary": [
      "recreation"
    ]
  },
  "tracking": {
    "ingested_at": "2026-10-20T20:57:14+00:00",
    "recipe_count": 1,
    "maintainers": [
      "OpenStack <openstack-discuss@lists.openstack.org>"
    ],
    "categories": [
      "python"
    ],
    "source_paths": [
      "https://pypi.org/pypi/oslo.utils/json"
    ],
    "source_repo_commits": [],
    "build_systems": [
      "pypi"
    ],
    "distributions": [
      {
        "type": "sdist",
        "url": "https://files.pythonhosted.org/packages/47/fd/7915fc0e2c959bcb3dbbe608deeeefe4264d03ba89a4fd75d74524326652/oslo_utils-10.2.0.tar.gz",
        "sha256": "ba839dea2c1eb415e3ee151c4cc688f52e283f59bc1f77cc86772190a8b34259"
      }
    ],
    "dropped_dependencies": [],
    "dep_edges": 10,
    "dep_resolved": 10,
    "dep_dangling": 0
  },
  "provenance": {
    "generated_by": "theseus.fabric",
    "imported_at": "2026-10-08T04:28:48+00:00",
    "confidence": 0.9,
    "sources": [
      {
        "path": "specs/oslo.utils.json",
        "kind": "package_recipe",
        "imported_at": "2026-10-08T04:28:48+00:00",
        "generated_by": "refresh_recipes.py",
        "source_path": "https://pypi.org/pypi/oslo.utils/json",
        "source_repo_commit": null,
        "confidence": 0.9,
        "unmapped": []
      }
    ],
    "warnings": []
  }
}
