{
  "schema_version": "1.1",
  "kind": "oss_fingerprint",
  "identity": {
    "canonical_name": "beautifulsoup4",
    "canonical_id": "pkg:beautifulsoup4",
    "aliases": []
  },
  "repository": {
    "url": null,
    "kind": null,
    "web": null,
    "confidence": 0.0,
    "source": null,
    "candidates": []
  },
  "license": {
    "spdx": [
      "MIT License"
    ],
    "raw": [
      "MIT License"
    ],
    "confidence": 0.9
  },
  "homepage": "https://www.crummy.com/software/BeautifulSoup/bs4/",
  "summary": "Screen-scraping library",
  "ecosystems": [
    {
      "ecosystem": "pypi",
      "ecosystem_id": "beautifulsoup4",
      "version": "4.15.0",
      "canonical_id": "pkg:beautifulsoup4"
    }
  ],
  "depends_on": [
    {
      "name": "soupsieve",
      "scope": "runtime",
      "ecosystem": "pypi",
      "resolved": false
    },
    {
      "name": "typing-extensions",
      "scope": "runtime",
      "ecosystem": "pypi",
      "resolved": true,
      "resolved_to": "typing-extensions"
    },
    {
      "name": "setuptools",
      "scope": "build",
      "ecosystem": "pypi",
      "resolved": true,
      "resolved_to": "setuptools"
    },
    {
      "name": "wheel",
      "scope": "build",
      "ecosystem": "pypi",
      "resolved": true,
      "resolved_to": "wheel"
    }
  ],
  "evidence": {
    "recipes": [
      "specs/beautifulsoup4.json"
    ],
    "behavioral_spec": null,
    "recreation": "secondary"
  },
  "priority": {
    "primary": [
      "provenance",
      "tracking",
      "dependencies"
    ],
    "secondary": [
      "recreation"
    ]
  },
  "tracking": {
    "ingested_at": "2026-10-20T20:57:14+00:00",
    "recipe_count": 1,
    "maintainers": [
      "Leonard Richardson <leonardr@segfault.org>"
    ],
    "categories": [
      "python"
    ],
    "source_paths": [
      "https://pypi.org/pypi/beautifulsoup4/json"
    ],
    "source_repo_commits": [],
    "build_systems": [
      "pypi"
    ],
    "distributions": [
      {
        "type": "sdist",
        "url": "https://files.pythonhosted.org/packages/43/65/318323f98dbee45d42dff61d8f047181bc6f2268a9068cfad035a46be5af/beautifulsoup4-4.15.0.tar.gz",
        "sha256": "288e3ca7d54b06f2ac191970bc275c1939cb46d450b255bf6718b04aa37ab4f7"
      }
    ],
    "dropped_dependencies": [],
    "dep_edges": 4,
    "dep_resolved": 3,
    "dep_dangling": 1
  },
  "provenance": {
    "generated_by": "theseus.fabric",
    "imported_at": "2026-10-20T20:56:39+00:00",
    "confidence": 0.9,
    "sources": [
      {
        "path": "specs/beautifulsoup4.json",
        "kind": "package_recipe",
        "imported_at": "2026-10-20T20:56:39+00:00",
        "generated_by": "bootstrap_canonical_recipes.py",
        "source_path": "https://pypi.org/pypi/beautifulsoup4/json",
        "source_repo_commit": null,
        "confidence": 0.9,
        "unmapped": []
      }
    ],
    "warnings": []
  }
}
