{
  "schema_version": "1.1",
  "kind": "oss_fingerprint",
  "identity": {
    "canonical_name": "zlib",
    "canonical_id": "pkg:zlib",
    "aliases": [
      "devel/linux-c7-zlib-devel",
      "archivers/zlib",
      "pkgs/development/libraries/zlib"
    ]
  },
  "repository": {
    "url": null,
    "kind": null,
    "web": null,
    "confidence": 0.0,
    "source": null,
    "candidates": [
      "https://github.com/brimworks/lua-zlib",
      "https://github.com/ruby/zlib"
    ]
  },
  "license": {
    "spdx": [
      "Zlib",
      "BSD-3-Clause"
    ],
    "raw": [
      "ZLIB",
      "BSD",
      "Zlib"
    ],
    "confidence": 0.9
  },
  "homepage": "https://zlib.net/",
  "summary": "Compression library implementing the deflate algorithm",
  "ecosystems": [
    {
      "ecosystem": "freebsd_ports",
      "ecosystem_id": "devel/linux-c7-zlib-devel",
      "version": "1.2.7",
      "canonical_id": "pkg:zlib"
    },
    {
      "ecosystem": "freebsd_ports",
      "ecosystem_id": "archivers/zlib",
      "version": "1.3.1",
      "canonical_id": "pkg:zlib"
    },
    {
      "ecosystem": "nixpkgs",
      "ecosystem_id": "pkgs/development/libraries/zlib",
      "version": "1.3.1",
      "canonical_id": "pkg:zlib"
    }
  ],
  "depends_on": [],
  "evidence": {
    "recipes": [
      "specs/zlib.json",
      "examples/freebsd_ports/zlib.json",
      "examples/nixpkgs/zlib.json"
    ],
    "behavioral_spec": "zspecs/zlib.zspec.zsdl",
    "recreation": "secondary"
  },
  "priority": {
    "primary": [
      "provenance",
      "tracking",
      "dependencies"
    ],
    "secondary": [
      "recreation"
    ]
  },
  "tracking": {
    "ingested_at": "2026-10-08T04:29:01+00:00",
    "recipe_count": 3,
    "maintainers": [
      "emulation@FreeBSD.org",
      "sirl33tname@gmail.com",
      "sunpoet@FreeBSD.org",
      "balsoft",
      "infinisil",
      "pyrox0",
      "md@FreeBSD.org"
    ],
    "categories": [
      "devel",
      "linux",
      "archivers",
      "libraries",
      "compression"
    ],
    "source_paths": [
      "devel/linux-c7-zlib-devel",
      "archivers/zlib",
      "pkgs/development/libraries/zlib"
    ],
    "source_repo_commits": [
      "7e6eb47aa71100bc6278d613df0743e2b1ddeaaf",
      "examplecommit"
    ],
    "build_systems": [
      "freebsd_ports_make",
      "autotools"
    ],
    "distributions": [
      {
        "type": "homepage",
        "url": "http://zlib.net/"
      },
      {
        "type": "homepage",
        "url": "https://github.com/brimworks/lua-zlib"
      },
      {
        "type": "homepage",
        "url": "https://github.com/ruby/zlib"
      },
      {
        "type": "master_sites",
        "url": "RG"
      },
      {
        "type": "homepage",
        "url": "https://zlib.net"
      },
      {
        "type": "homepage",
        "url": "https://zlib.net/"
      },
      {
        "type": "master_sites",
        "url": "https://zlib.net/"
      },
      {
        "type": "archive",
        "url": "https://zlib.net/zlib-1.3.1.tar.xz"
      }
    ],
    "dropped_dependencies": [],
    "dep_edges": 0,
    "dep_resolved": 0,
    "dep_dangling": 0
  },
  "provenance": {
    "generated_by": "theseus.fabric",
    "imported_at": "2026-10-08T04:28:54+00:00",
    "confidence": 0.9333,
    "sources": [
      {
        "path": "specs/zlib.json",
        "kind": "package_recipe",
        "imported_at": "2026-10-08T04:28:54+00:00",
        "generated_by": "refresh_recipes.py",
        "source_path": "devel/linux-c7-zlib-devel",
        "source_repo_commit": "7e6eb47aa71100bc6278d613df0743e2b1ddeaaf",
        "confidence": 0.95,
        "unmapped": []
      },
      {
        "path": "examples/freebsd_ports/zlib.json",
        "kind": "package_recipe",
        "imported_at": "2026-03-26T00:00:00+00:00",
        "generated_by": "hand-written example",
        "source_path": "archivers/zlib",
        "source_repo_commit": "examplecommit",
        "confidence": 0.9,
        "unmapped": []
      },
      {
        "path": "examples/nixpkgs/zlib.json",
        "kind": "package_recipe",
        "imported_at": "2026-03-26T12:00:00+00:00",
        "generated_by": "bootstrap_canonical_recipes.py",
        "source_path": "pkgs/development/libraries/zlib",
        "source_repo_commit": "examplecommit",
        "confidence": 0.95,
        "unmapped": []
      }
    ],
    "warnings": [
      "partial refresh; kept prior data for: nixpkgs"
    ]
  }
}
