{
  "schema_version": "1.1",
  "kind": "oss_fingerprint",
  "identity": {
    "canonical_name": "xo",
    "canonical_id": "pkg:xo",
    "aliases": []
  },
  "repository": {
    "url": "https://github.com/xojs/xo",
    "kind": "git",
    "web": "https://github.com/xojs/xo",
    "confidence": 0.95,
    "source": "npm.source_repository",
    "candidates": []
  },
  "license": {
    "spdx": [
      "MIT"
    ],
    "raw": [
      "MIT"
    ],
    "confidence": 0.9
  },
  "homepage": "https://github.com/xojs/xo#readme",
  "summary": "JavaScript/TypeScript linter (ESLint wrapper) with great defaults",
  "ecosystems": [
    {
      "ecosystem": "npm",
      "ecosystem_id": "xo",
      "version": "5.0.1",
      "canonical_id": "pkg:xo"
    }
  ],
  "depends_on": [
    {
      "name": "jiti",
      "scope": "runtime",
      "ecosystem": "npm",
      "resolved": false
    },
    {
      "name": "meow",
      "scope": "runtime",
      "ecosystem": "npm",
      "resolved": false
    },
    {
      "name": "arrify",
      "scope": "runtime",
      "ecosystem": "npm",
      "resolved": false
    },
    {
      "name": "eslint",
      "scope": "runtime",
      "ecosystem": "npm",
      "resolved": true,
      "resolved_to": "eslint"
    },
    {
      "name": "globby",
      "scope": "runtime",
      "ecosystem": "npm",
      "resolved": false
    },
    {
      "name": "prettier",
      "scope": "runtime",
      "ecosystem": "npm",
      "resolved": true,
      "resolved_to": "prettier"
    },
    {
      "name": "get-stdin",
      "scope": "runtime",
      "ecosystem": "npm",
      "resolved": false
    },
    {
      "name": "type-fest",
      "scope": "runtime",
      "ecosystem": "npm",
      "resolved": false
    },
    {
      "name": "micromatch",
      "scope": "runtime",
      "ecosystem": "npm",
      "resolved": false
    },
    {
      "name": "typescript",
      "scope": "runtime",
      "ecosystem": "npm",
      "resolved": true,
      "resolved_to": "typescript"
    },
    {
      "name": "cosmiconfig",
      "scope": "runtime",
      "ecosystem": "npm",
      "resolved": false
    },
    {
      "name": "open-editor",
      "scope": "runtime",
      "ecosystem": "npm",
      "resolved": false
    },
    {
      "name": "path-exists",
      "scope": "runtime",
      "ecosystem": "npm",
      "resolved": false
    },
    {
      "name": "get-tsconfig",
      "scope": "runtime",
      "ecosystem": "npm",
      "resolved": false
    },
    {
      "name": "define-lazy-prop",
      "scope": "runtime",
      "ecosystem": "npm",
      "resolved": false
    },
    {
      "name": "eslint-config-xo",
      "scope": "runtime",
      "ecosystem": "npm",
      "resolved": false
    },
    {
      "name": "find-cache-directory",
      "scope": "runtime",
      "ecosystem": "npm",
      "resolved": false
    },
    {
      "name": "@sindresorhus/tsconfig",
      "scope": "runtime",
      "ecosystem": "npm",
      "resolved": false
    },
    {
      "name": "eslint-formatter-pretty",
      "scope": "runtime",
      "ecosystem": "npm",
      "resolved": false
    },
    {
      "name": "np",
      "scope": "build",
      "ecosystem": "npm",
      "resolved": false
    },
    {
      "name": "xo",
      "scope": "build",
      "ecosystem": "npm",
      "resolved": true,
      "resolved_to": "xo"
    },
    {
      "name": "execa",
      "scope": "build",
      "ecosystem": "npm",
      "resolved": false
    },
    {
      "name": "husky",
      "scope": "build",
      "ecosystem": "npm",
      "resolved": true,
      "resolved_to": "husky"
    },
    {
      "name": "dedent",
      "scope": "build",
      "ecosystem": "npm",
      "resolved": false
    },
    {
      "name": "temp-dir",
      "scope": "build",
      "ecosystem": "npm",
      "resolved": false
    },
    {
      "name": "@types/node",
      "scope": "build",
      "ecosystem": "npm",
      "resolved": true,
      "resolved_to": "types__node"
    },
    {
      "name": "@types/micromatch",
      "scope": "build",
      "ecosystem": "npm",
      "resolved": false
    },
    {
      "name": "eslint-plugin-vue",
      "scope": "build",
      "ecosystem": "npm",
      "resolved": false
    }
  ],
  "evidence": {
    "recipes": [
      "specs/xo.json"
    ],
    "behavioral_spec": null,
    "recreation": "secondary"
  },
  "priority": {
    "primary": [
      "provenance",
      "tracking",
      "dependencies"
    ],
    "secondary": [
      "recreation"
    ]
  },
  "tracking": {
    "ingested_at": "2026-10-20T21:30:01+00:00",
    "recipe_count": 1,
    "maintainers": [
      "sindresorhus@gmail.com"
    ],
    "categories": [
      "javascript"
    ],
    "source_paths": [
      "https://registry.npmjs.org/xo"
    ],
    "source_repo_commits": [],
    "build_systems": [
      "npm"
    ],
    "distributions": [
      {
        "type": "tarball",
        "url": "https://registry.npmjs.org/xo/-/xo-5.0.1.tgz"
      }
    ],
    "dropped_dependencies": [],
    "dep_edges": 28,
    "dep_resolved": 6,
    "dep_dangling": 22
  },
  "provenance": {
    "generated_by": "theseus.fabric",
    "imported_at": "2026-10-20T21:29:59+00:00",
    "confidence": 0.85,
    "sources": [
      {
        "path": "specs/xo.json",
        "kind": "package_recipe",
        "imported_at": "2026-10-20T21:29:59+00:00",
        "generated_by": "bootstrap_canonical_recipes.py",
        "source_path": "https://registry.npmjs.org/xo",
        "source_repo_commit": null,
        "confidence": 0.85,
        "unmapped": []
      }
    ],
    "warnings": []
  }
}
