{
  "schema_version": "1.1",
  "kind": "oss_fingerprint",
  "identity": {
    "canonical_name": "autoreconf-hook",
    "canonical_id": "pkg:autoreconf-hook",
    "aliases": [
      "pkgs/top-level"
    ]
  },
  "repository": {
    "url": "https://github.com/NixOS/nixpkgs",
    "kind": "git",
    "web": "https://github.com/NixOS/nixpkgs",
    "confidence": 0.8,
    "source": "homepage",
    "candidates": []
  },
  "license": {
    "spdx": [
      "MIT"
    ],
    "raw": [
      "MIT",
      "MIT",
      "MIT",
      "MIT",
      "MIT",
      "MIT",
      "MIT",
      "MIT",
      "MIT",
      "MIT",
      "MIT",
      "MIT",
      "MIT",
      "MIT",
      "MIT",
      "MIT",
      "MIT",
      "MIT",
      "MIT",
      "MIT",
      "MIT",
      "MIT"
    ],
    "confidence": 0.9
  },
  "homepage": "https://github.com/NixOS/nixpkgs/blob/master/pkgs/build-support/setup-hooks/autoreconf.sh",
  "summary": "Utility which reads and writes data across network connections — LibreSSL implementation",
  "ecosystems": [
    {
      "ecosystem": "nixpkgs",
      "ecosystem_id": "pkgs/top-level",
      "version": "2.9.3",
      "canonical_id": "pkg:autoreconf-hook"
    }
  ],
  "depends_on": [
    {
      "name": "dieHook",
      "scope": "runtime",
      "ecosystem": "nixpkgs",
      "resolved": false
    },
    {
      "name": "with-env",
      "scope": "host",
      "ecosystem": "nixpkgs",
      "resolved": false
    },
    {
      "name": "cctools",
      "scope": "host",
      "ecosystem": "nixpkgs",
      "resolved": false
    }
  ],
  "evidence": {
    "recipes": [
      "specs/autoreconf-hook.json"
    ],
    "behavioral_spec": null,
    "recreation": "secondary"
  },
  "priority": {
    "primary": [
      "provenance",
      "tracking",
      "dependencies"
    ],
    "secondary": [
      "recreation"
    ]
  },
  "tracking": {
    "ingested_at": "2026-10-08T04:29:01+00:00",
    "recipe_count": 1,
    "maintainers": [],
    "categories": [],
    "source_paths": [
      "pkgs/top-level/all-packages.nix"
    ],
    "source_repo_commits": [
      "144baa99f5e19735361b0be3cb11f7d6ef251dcc"
    ],
    "build_systems": [
      "cmake"
    ],
    "distributions": [
      {
        "type": "archive",
        "url": "https://git.dev.opencascade.org/gitweb/?p=occt.git;a=snapshot;h=${commit};sf=tgz"
      }
    ],
    "dropped_dependencies": [],
    "dep_edges": 3,
    "dep_resolved": 0,
    "dep_dangling": 3
  },
  "provenance": {
    "generated_by": "theseus.fabric",
    "imported_at": "2026-10-08T04:28:40+00:00",
    "confidence": 0.88,
    "sources": [
      {
        "path": "specs/autoreconf-hook.json",
        "kind": "package_recipe",
        "imported_at": "2026-10-08T04:28:40+00:00",
        "generated_by": "refresh_recipes.py",
        "source_path": "pkgs/top-level/all-packages.nix",
        "source_repo_commit": "144baa99f5e19735361b0be3cb11f7d6ef251dcc",
        "confidence": 0.88,
        "unmapped": [
          "homepage"
        ]
      }
    ],
    "warnings": []
  }
}
