{
  "schema_version": "1.1",
  "kind": "oss_fingerprint",
  "identity": {
    "canonical_name": "botocore",
    "canonical_id": "pkg:botocore",
    "aliases": []
  },
  "repository": {
    "url": "https://github.com/boto/botocore",
    "kind": "git",
    "web": "https://github.com/boto/botocore",
    "confidence": 0.95,
    "source": "pypi.source_repository",
    "candidates": []
  },
  "license": {
    "spdx": [
      "Apache-2.0"
    ],
    "raw": [
      "Apache-2.0"
    ],
    "confidence": 0.9
  },
  "homepage": "https://github.com/boto/botocore",
  "summary": "Low-level, data-driven core of boto 3.",
  "ecosystems": [
    {
      "ecosystem": "pypi",
      "ecosystem_id": "botocore",
      "version": "1.43.116",
      "canonical_id": "pkg:botocore"
    }
  ],
  "depends_on": [
    {
      "name": "jmespath",
      "scope": "runtime",
      "ecosystem": "pypi",
      "resolved": false
    },
    {
      "name": "python-dateutil",
      "scope": "runtime",
      "ecosystem": "pypi",
      "resolved": true,
      "resolved_to": "python-dateutil"
    },
    {
      "name": "urllib3",
      "scope": "runtime",
      "ecosystem": "pypi",
      "resolved": true,
      "resolved_to": "urllib3"
    },
    {
      "name": "setuptools",
      "scope": "build",
      "ecosystem": "pypi",
      "resolved": true,
      "resolved_to": "setuptools"
    },
    {
      "name": "wheel",
      "scope": "build",
      "ecosystem": "pypi",
      "resolved": true,
      "resolved_to": "wheel"
    }
  ],
  "evidence": {
    "recipes": [
      "specs/botocore.json"
    ],
    "behavioral_spec": null,
    "recreation": "secondary"
  },
  "priority": {
    "primary": [
      "provenance",
      "tracking",
      "dependencies"
    ],
    "secondary": [
      "recreation"
    ]
  },
  "tracking": {
    "ingested_at": "2026-10-20T20:57:14+00:00",
    "recipe_count": 1,
    "maintainers": [
      "Amazon Web Services"
    ],
    "categories": [
      "python"
    ],
    "source_paths": [
      "https://pypi.org/pypi/botocore/json"
    ],
    "source_repo_commits": [],
    "build_systems": [
      "pypi"
    ],
    "distributions": [
      {
        "type": "sdist",
        "url": "https://files.pythonhosted.org/packages/93/98/aff05e8a35f5bb9f6648c6056ecff02a2bd4540ad70a89215db8a0cae758/botocore-1.43.116.tar.gz",
        "sha256": "00b1fbfc1c024b56633538385628a1bbc7ab15aca0b5b53e5fe188841d96c8ce"
      }
    ],
    "dropped_dependencies": [],
    "dep_edges": 5,
    "dep_resolved": 4,
    "dep_dangling": 1
  },
  "provenance": {
    "generated_by": "theseus.fabric",
    "imported_at": "2026-10-20T20:56:41+00:00",
    "confidence": 0.9,
    "sources": [
      {
        "path": "specs/botocore.json",
        "kind": "package_recipe",
        "imported_at": "2026-10-20T20:56:41+00:00",
        "generated_by": "bootstrap_canonical_recipes.py",
        "source_path": "https://pypi.org/pypi/botocore/json",
        "source_repo_commit": null,
        "confidence": 0.9,
        "unmapped": []
      }
    ],
    "warnings": []
  }
}
