{
  "schema_version": "1.1",
  "kind": "oss_fingerprint",
  "identity": {
    "canonical_name": "tomlkit",
    "canonical_id": "pkg:tomlkit",
    "aliases": []
  },
  "repository": {
    "url": "https://github.com/python-poetry/tomlkit",
    "kind": "git",
    "web": "https://github.com/python-poetry/tomlkit",
    "confidence": 0.95,
    "source": "pypi.source_repository",
    "candidates": []
  },
  "license": {
    "spdx": [
      "MIT"
    ],
    "raw": [
      "MIT"
    ],
    "confidence": 0.9
  },
  "homepage": "https://github.com/python-poetry/tomlkit",
  "summary": "Style preserving TOML library",
  "ecosystems": [
    {
      "ecosystem": "pypi",
      "ecosystem_id": "tomlkit",
      "version": "0.15.2",
      "canonical_id": "pkg:tomlkit"
    }
  ],
  "depends_on": [],
  "evidence": {
    "recipes": [
      "specs/tomlkit.json"
    ],
    "behavioral_spec": "zspecs/tomlkit.zspec.zsdl",
    "recreation": "secondary"
  },
  "priority": {
    "primary": [
      "provenance",
      "tracking",
      "dependencies"
    ],
    "secondary": [
      "recreation"
    ]
  },
  "tracking": {
    "ingested_at": "2026-10-20T21:29:58+00:00",
    "recipe_count": 1,
    "maintainers": [
      "sebastien@eustace.io"
    ],
    "categories": [
      "python"
    ],
    "source_paths": [
      "https://pypi.org/pypi/tomlkit/json"
    ],
    "source_repo_commits": [],
    "build_systems": [
      "pypi"
    ],
    "distributions": [
      {
        "type": "sdist",
        "url": "https://files.pythonhosted.org/packages/08/72/fc01563df95c189a9f65850096bdc205bc2fe37da6c740cd64afaf18d07e/tomlkit-0.15.2.tar.gz",
        "sha256": "83e32755ba1d20d9340bd069ee97e9f6232ba2346b63ffcba425de01f7e327a6"
      }
    ],
    "dropped_dependencies": [],
    "dep_edges": 0,
    "dep_resolved": 0,
    "dep_dangling": 0
  },
  "provenance": {
    "generated_by": "theseus.fabric",
    "imported_at": "2026-10-20T21:29:08+00:00",
    "confidence": 0.9,
    "sources": [
      {
        "path": "specs/tomlkit.json",
        "kind": "package_recipe",
        "imported_at": "2026-10-20T21:29:08+00:00",
        "generated_by": "refresh_recipes.py",
        "source_path": "https://pypi.org/pypi/tomlkit/json",
        "source_repo_commit": null,
        "confidence": 0.9,
        "unmapped": []
      }
    ],
    "warnings": [
      "Build requirements are unavailable from PyPI JSON metadata; no build dependencies inferred."
    ]
  }
}
