{
  "schema_version": "1.1",
  "kind": "oss_fingerprint",
  "identity": {
    "canonical_name": "eslint-plugin-eslint-plugin",
    "canonical_id": "pkg:eslint-plugin-eslint-plugin",
    "aliases": []
  },
  "repository": {
    "url": "https://github.com/eslint-community/eslint-plugin-eslint-plugin",
    "kind": "git",
    "web": "https://github.com/eslint-community/eslint-plugin-eslint-plugin",
    "confidence": 0.95,
    "source": "npm.source_repository",
    "candidates": []
  },
  "license": {
    "spdx": [
      "MIT"
    ],
    "raw": [
      "MIT"
    ],
    "confidence": 0.9
  },
  "homepage": "https://github.com/eslint-community/eslint-plugin-eslint-plugin#readme",
  "summary": "An ESLint plugin for linting ESLint plugins",
  "ecosystems": [
    {
      "ecosystem": "npm",
      "ecosystem_id": "eslint-plugin-eslint-plugin",
      "version": "7.6.2",
      "canonical_id": "pkg:eslint-plugin-eslint-plugin"
    }
  ],
  "depends_on": [
    {
      "name": "@eslint-community/eslint-utils",
      "scope": "runtime",
      "ecosystem": "npm",
      "resolved": false
    },
    {
      "name": "estraverse",
      "scope": "runtime",
      "ecosystem": "npm",
      "resolved": false
    },
    {
      "name": "@commitlint/cli",
      "scope": "build",
      "ecosystem": "npm",
      "resolved": false
    },
    {
      "name": "@commitlint/config-conventional",
      "scope": "build",
      "ecosystem": "npm",
      "resolved": false
    },
    {
      "name": "@commitlint/types",
      "scope": "build",
      "ecosystem": "npm",
      "resolved": false
    },
    {
      "name": "@eslint-community/eslint-plugin-eslint-comments",
      "scope": "build",
      "ecosystem": "npm",
      "resolved": false
    },
    {
      "name": "@eslint/eslintrc",
      "scope": "build",
      "ecosystem": "npm",
      "resolved": false
    },
    {
      "name": "@eslint/js",
      "scope": "build",
      "ecosystem": "npm",
      "resolved": false
    },
    {
      "name": "@eslint/markdown",
      "scope": "build",
      "ecosystem": "npm",
      "resolved": false
    },
    {
      "name": "@types/eslint-scope",
      "scope": "build",
      "ecosystem": "npm",
      "resolved": false
    },
    {
      "name": "@types/espree",
      "scope": "build",
      "ecosystem": "npm",
      "resolved": false
    },
    {
      "name": "@types/estraverse",
      "scope": "build",
      "ecosystem": "npm",
      "resolved": false
    },
    {
      "name": "@types/estree",
      "scope": "build",
      "ecosystem": "npm",
      "resolved": false
    },
    {
      "name": "@types/lodash",
      "scope": "build",
      "ecosystem": "npm",
      "resolved": false
    },
    {
      "name": "@types/node",
      "scope": "build",
      "ecosystem": "npm",
      "resolved": true,
      "resolved_to": "types__node"
    },
    {
      "name": "@typescript-eslint/parser",
      "scope": "build",
      "ecosystem": "npm",
      "resolved": true,
      "resolved_to": "typescript-eslint__parser"
    },
    {
      "name": "@typescript-eslint/utils",
      "scope": "build",
      "ecosystem": "npm",
      "resolved": false
    },
    {
      "name": "@vitest/coverage-istanbul",
      "scope": "build",
      "ecosystem": "npm",
      "resolved": false
    },
    {
      "name": "eslint",
      "scope": "build",
      "ecosystem": "npm",
      "resolved": true,
      "resolved_to": "eslint"
    },
    {
      "name": "eslint-config-not-an-aardvark",
      "scope": "build",
      "ecosystem": "npm",
      "resolved": false
    },
    {
      "name": "eslint-config-prettier",
      "scope": "build",
      "ecosystem": "npm",
      "resolved": false
    },
    {
      "name": "eslint-doc-generator",
      "scope": "build",
      "ecosystem": "npm",
      "resolved": false
    },
    {
      "name": "eslint-plugin-n",
      "scope": "build",
      "ecosystem": "npm",
      "resolved": true,
      "resolved_to": "eslint-plugin-n"
    },
    {
      "name": "eslint-plugin-unicorn",
      "scope": "build",
      "ecosystem": "npm",
      "resolved": false
    },
    {
      "name": "eslint-remote-tester",
      "scope": "build",
      "ecosystem": "npm",
      "resolved": false
    },
    {
      "name": "eslint-scope",
      "scope": "build",
      "ecosystem": "npm",
      "resolved": false
    },
    {
      "name": "espree",
      "scope": "build",
      "ecosystem": "npm",
      "resolved": false
    },
    {
      "name": "husky",
      "scope": "build",
      "ecosystem": "npm",
      "resolved": true,
      "resolved_to": "husky"
    },
    {
      "name": "jiti",
      "scope": "build",
      "ecosystem": "npm",
      "resolved": false
    },
    {
      "name": "lint-staged",
      "scope": "build",
      "ecosystem": "npm",
      "resolved": true,
      "resolved_to": "lint-staged"
    },
    {
      "name": "lodash",
      "scope": "build",
      "ecosystem": "npm",
      "resolved": true,
      "resolved_to": "lodash"
    },
    {
      "name": "markdownlint-cli",
      "scope": "build",
      "ecosystem": "npm",
      "resolved": false
    },
    {
      "name": "npm-package-json-lint",
      "scope": "build",
      "ecosystem": "npm",
      "resolved": false
    },
    {
      "name": "npm-run-all2",
      "scope": "build",
      "ecosystem": "npm",
      "resolved": true,
      "resolved_to": "npm-run-all2"
    },
    {
      "name": "prettier",
      "scope": "build",
      "ecosystem": "npm",
      "resolved": true,
      "resolved_to": "prettier"
    },
    {
      "name": "tsdown",
      "scope": "build",
      "ecosystem": "npm",
      "resolved": false
    },
    {
      "name": "typescript",
      "scope": "build",
      "ecosystem": "npm",
      "resolved": true,
      "resolved_to": "typescript"
    },
    {
      "name": "typescript-eslint",
      "scope": "build",
      "ecosystem": "npm",
      "resolved": false
    },
    {
      "name": "vitest",
      "scope": "build",
      "ecosystem": "npm",
      "resolved": true,
      "resolved_to": "vitest"
    },
    {
      "name": "eslint",
      "scope": "host",
      "ecosystem": "npm",
      "resolved": true,
      "resolved_to": "eslint"
    }
  ],
  "evidence": {
    "recipes": [
      "specs/eslint-plugin-eslint-plugin.json"
    ],
    "behavioral_spec": null,
    "recreation": "secondary"
  },
  "priority": {
    "primary": [
      "provenance",
      "tracking",
      "dependencies"
    ],
    "secondary": [
      "recreation"
    ]
  },
  "tracking": {
    "ingested_at": "2026-10-20T21:30:01+00:00",
    "recipe_count": 1,
    "maintainers": [
      "info@michaeldeboey.be",
      "contact+eslintcbot@eslint.org"
    ],
    "categories": [
      "javascript"
    ],
    "source_paths": [
      "https://registry.npmjs.org/eslint-plugin-eslint-plugin"
    ],
    "source_repo_commits": [],
    "build_systems": [
      "npm"
    ],
    "distributions": [
      {
        "type": "tarball",
        "url": "https://registry.npmjs.org/eslint-plugin-eslint-plugin/-/eslint-plugin-eslint-plugin-7.6.2.tgz"
      }
    ],
    "dropped_dependencies": [],
    "dep_edges": 40,
    "dep_resolved": 12,
    "dep_dangling": 28
  },
  "provenance": {
    "generated_by": "theseus.fabric",
    "imported_at": "2026-10-20T21:30:01+00:00",
    "confidence": 0.85,
    "sources": [
      {
        "path": "specs/eslint-plugin-eslint-plugin.json",
        "kind": "package_recipe",
        "imported_at": "2026-10-20T21:30:01+00:00",
        "generated_by": "bootstrap_canonical_recipes.py",
        "source_path": "https://registry.npmjs.org/eslint-plugin-eslint-plugin",
        "source_repo_commit": null,
        "confidence": 0.85,
        "unmapped": []
      }
    ],
    "warnings": []
  }
}
