{
  "schema_version": "1.1",
  "kind": "oss_fingerprint",
  "identity": {
    "canonical_name": "globals",
    "canonical_id": "pkg:globals",
    "aliases": []
  },
  "repository": {
    "url": "https://github.com/sindresorhus/globals",
    "kind": "git",
    "web": "https://github.com/sindresorhus/globals",
    "confidence": 0.95,
    "source": "npm.source_repository",
    "candidates": []
  },
  "license": {
    "spdx": [
      "MIT"
    ],
    "raw": [
      "MIT"
    ],
    "confidence": 0.9
  },
  "homepage": "https://github.com/sindresorhus/globals#readme",
  "summary": "Global identifiers from different JavaScript environments",
  "ecosystems": [
    {
      "ecosystem": "npm",
      "ecosystem_id": "globals",
      "version": "17.13.0",
      "canonical_id": "pkg:globals"
    }
  ],
  "depends_on": [
    {
      "name": "xo",
      "scope": "build",
      "ecosystem": "npm",
      "resolved": false
    },
    {
      "name": "ava",
      "scope": "build",
      "ecosystem": "npm",
      "resolved": false
    },
    {
      "name": "tsd",
      "scope": "build",
      "ecosystem": "npm",
      "resolved": false
    },
    {
      "name": "cheerio",
      "scope": "build",
      "ecosystem": "npm",
      "resolved": false
    },
    {
      "name": "outdent",
      "scope": "build",
      "ecosystem": "npm",
      "resolved": false
    },
    {
      "name": "shelljs",
      "scope": "build",
      "ecosystem": "npm",
      "resolved": false
    },
    {
      "name": "get-port",
      "scope": "build",
      "ecosystem": "npm",
      "resolved": false
    },
    {
      "name": "puppeteer",
      "scope": "build",
      "ecosystem": "npm",
      "resolved": false
    },
    {
      "name": "type-fest",
      "scope": "build",
      "ecosystem": "npm",
      "resolved": false
    },
    {
      "name": "nano-spawn",
      "scope": "build",
      "ecosystem": "npm",
      "resolved": false
    },
    {
      "name": "npm-run-all2",
      "scope": "build",
      "ecosystem": "npm",
      "resolved": false
    },
    {
      "name": "is-identifier",
      "scope": "build",
      "ecosystem": "npm",
      "resolved": false
    },
    {
      "name": "eslint-plugin-jest",
      "scope": "build",
      "ecosystem": "npm",
      "resolved": false
    },
    {
      "name": "@vitest/eslint-plugin",
      "scope": "build",
      "ecosystem": "npm",
      "resolved": false
    }
  ],
  "evidence": {
    "recipes": [
      "specs/globals.json"
    ],
    "behavioral_spec": null,
    "recreation": "secondary"
  },
  "priority": {
    "primary": [
      "provenance",
      "tracking",
      "dependencies"
    ],
    "secondary": [
      "recreation"
    ]
  },
  "tracking": {
    "ingested_at": "2026-10-20T20:57:14+00:00",
    "recipe_count": 1,
    "maintainers": [
      "ben@byk.im",
      "nicholas@nczconsulting.com",
      "schreck.mathias@gmail.com",
      "sindresorhus@gmail.com"
    ],
    "categories": [
      "javascript"
    ],
    "source_paths": [
      "https://registry.npmjs.org/globals"
    ],
    "source_repo_commits": [],
    "build_systems": [
      "npm"
    ],
    "distributions": [
      {
        "type": "tarball",
        "url": "https://registry.npmjs.org/globals/-/globals-17.13.0.tgz"
      }
    ],
    "dropped_dependencies": [],
    "dep_edges": 14,
    "dep_resolved": 0,
    "dep_dangling": 14
  },
  "provenance": {
    "generated_by": "theseus.fabric",
    "imported_at": "2026-10-20T20:57:05+00:00",
    "confidence": 0.85,
    "sources": [
      {
        "path": "specs/globals.json",
        "kind": "package_recipe",
        "imported_at": "2026-10-20T20:57:05+00:00",
        "generated_by": "bootstrap_canonical_recipes.py",
        "source_path": "https://registry.npmjs.org/globals",
        "source_repo_commit": null,
        "confidence": 0.85,
        "unmapped": []
      }
    ],
    "warnings": []
  }
}
