{
  "schema_version": "1.1",
  "kind": "oss_fingerprint",
  "identity": {
    "canonical_name": "markupsafe",
    "canonical_id": "pkg:markupsafe",
    "aliases": [
      "MarkupSafe"
    ]
  },
  "repository": {
    "url": "https://github.com/pallets/markupsafe",
    "kind": "git",
    "web": "https://github.com/pallets/markupsafe",
    "confidence": 0.95,
    "source": "pypi.source_repository",
    "candidates": []
  },
  "license": {
    "spdx": [
      "BSD-3-Clause"
    ],
    "raw": [
      "BSD-3-Clause"
    ],
    "confidence": 0.9
  },
  "homepage": "https://markupsafe.palletsprojects.com/",
  "summary": "Safely add untrusted strings to HTML/XML markup.",
  "ecosystems": [
    {
      "ecosystem": "pypi",
      "ecosystem_id": "MarkupSafe",
      "version": "3.0.4",
      "canonical_id": "pkg:markupsafe"
    }
  ],
  "depends_on": [],
  "evidence": {
    "recipes": [
      "specs/markupsafe.json"
    ],
    "behavioral_spec": "zspecs/markupsafe.zspec.zsdl",
    "recreation": "secondary"
  },
  "priority": {
    "primary": [
      "provenance",
      "tracking",
      "dependencies"
    ],
    "secondary": [
      "recreation"
    ]
  },
  "tracking": {
    "ingested_at": "2026-10-20T21:29:58+00:00",
    "recipe_count": 1,
    "maintainers": [
      "Pallets <contact@palletsprojects.com>"
    ],
    "categories": [
      "python"
    ],
    "source_paths": [
      "https://pypi.org/pypi/MarkupSafe/json"
    ],
    "source_repo_commits": [],
    "build_systems": [
      "pypi"
    ],
    "distributions": [
      {
        "type": "sdist",
        "url": "https://files.pythonhosted.org/packages/38/9b/e422a865e1d5d57d0e509b4e0bf1c1a70a7f6382c29a5aa428df994c8bc8/markupsafe-3.0.4.tar.gz",
        "sha256": "2e9ad7dd851bf45fab9f75cbff4cb493fee9979e8d8c7c9c3ee119022518edd6"
      }
    ],
    "dropped_dependencies": [],
    "dep_edges": 0,
    "dep_resolved": 0,
    "dep_dangling": 0
  },
  "provenance": {
    "generated_by": "theseus.fabric",
    "imported_at": "2026-10-20T21:29:04+00:00",
    "confidence": 0.9,
    "sources": [
      {
        "path": "specs/markupsafe.json",
        "kind": "package_recipe",
        "imported_at": "2026-10-20T21:29:04+00:00",
        "generated_by": "refresh_recipes.py",
        "source_path": "https://pypi.org/pypi/MarkupSafe/json",
        "source_repo_commit": null,
        "confidence": 0.9,
        "unmapped": []
      }
    ],
    "warnings": [
      "Build requirements are unavailable from PyPI JSON metadata; no build dependencies inferred."
    ]
  }
}
