{
  "schema_version": "1.1",
  "kind": "oss_fingerprint",
  "identity": {
    "canonical_name": "traitlets",
    "canonical_id": "pkg:traitlets",
    "aliases": []
  },
  "repository": {
    "url": "https://github.com/ipython/traitlets",
    "kind": "git",
    "web": "https://github.com/ipython/traitlets",
    "confidence": 0.95,
    "source": "pypi.source_repository",
    "candidates": []
  },
  "license": {
    "spdx": [
      "BSD 3-Clause License\n        \n        - Copyright (c) 2001-, IPython Development Team\n        \n        All rights reserved.\n        \n        Redistribution and use in source and binary forms, with or without\n        modification, are permitted provided that the following conditions are met:\n        \n        1. Redistributions of source code must retain the above copyright notice, this\n           list of conditions and the following disclaimer.\n        \n        2. Redistributions in binary form must reproduce the above copyright notice,\n           this list of conditions and the following disclaimer in the documentation\n           and/or other materials provided with the distribution.\n        \n        3. Neither the name of the copyright holder nor the names of its\n           contributors may be used to endorse or promote products derived from\n           this software without specific prior written permission.\n        \n        THIS SOFTWARE IS PROVIDED BY THE COPYRIGHT HOLDERS AND CONTRIBUTORS \"AS IS\"\n        AND ANY EXPRESS OR IMPLIED WARRANTIES, INCLUDING, BUT NOT LIMITED TO, THE\n        IMPLIED WARRANTIES OF MERCHANTABILITY AND FITNESS FOR A PARTICULAR PURPOSE ARE\n        DISCLAIMED. IN NO EVENT SHALL THE COPYRIGHT HOLDER OR CONTRIBUTORS BE LIABLE\n        FOR ANY DIRECT, INDIRECT, INCIDENTAL, SPECIAL, EXEMPLARY, OR CONSEQUENTIAL\n        DAMAGES (INCLUDING, BUT NOT LIMITED TO, PROCUREMENT OF SUBSTITUTE GOODS OR\n        SERVICES; LOSS OF USE, DATA, OR PROFITS; OR BUSINESS INTERRUPTION) HOWEVER\n        CAUSED AND ON ANY THEORY OF LIABILITY, WHETHER IN CONTRACT, STRICT LIABILITY,\n        OR TORT (INCLUDING NEGLIGENCE OR OTHERWISE) ARISING IN ANY WAY OUT OF THE USE\n        OF THIS SOFTWARE, EVEN IF ADVISED OF THE POSSIBILITY OF SUCH DAMAGE."
    ],
    "raw": [
      "BSD 3-Clause License\n        \n        - Copyright (c) 2001-, IPython Development Team\n        \n        All rights reserved.\n        \n        Redistribution and use in source and binary forms, with or without\n        modification, are permitted provided that the following conditions are met:\n        \n        1. Redistributions of source code must retain the above copyright notice, this\n           list of conditions and the following disclaimer.\n        \n        2. Redistributions in binary form must reproduce the above copyright notice,\n           this list of conditions and the following disclaimer in the documentation\n           and/or other materials provided with the distribution.\n        \n        3. Neither the name of the copyright holder nor the names of its\n           contributors may be used to endorse or promote products derived from\n           this software without specific prior written permission.\n        \n        THIS SOFTWARE IS PROVIDED BY THE COPYRIGHT HOLDERS AND CONTRIBUTORS \"AS IS\"\n        AND ANY EXPRESS OR IMPLIED WARRANTIES, INCLUDING, BUT NOT LIMITED TO, THE\n        IMPLIED WARRANTIES OF MERCHANTABILITY AND FITNESS FOR A PARTICULAR PURPOSE ARE\n        DISCLAIMED. IN NO EVENT SHALL THE COPYRIGHT HOLDER OR CONTRIBUTORS BE LIABLE\n        FOR ANY DIRECT, INDIRECT, INCIDENTAL, SPECIAL, EXEMPLARY, OR CONSEQUENTIAL\n        DAMAGES (INCLUDING, BUT NOT LIMITED TO, PROCUREMENT OF SUBSTITUTE GOODS OR\n        SERVICES; LOSS OF USE, DATA, OR PROFITS; OR BUSINESS INTERRUPTION) HOWEVER\n        CAUSED AND ON ANY THEORY OF LIABILITY, WHETHER IN CONTRACT, STRICT LIABILITY,\n        OR TORT (INCLUDING NEGLIGENCE OR OTHERWISE) ARISING IN ANY WAY OUT OF THE USE\n        OF THIS SOFTWARE, EVEN IF ADVISED OF THE POSSIBILITY OF SUCH DAMAGE."
    ],
    "confidence": 0.9
  },
  "homepage": "https://github.com/ipython/traitlets",
  "summary": "Traitlets Python configuration system",
  "ecosystems": [
    {
      "ecosystem": "pypi",
      "ecosystem_id": "traitlets",
      "version": "5.16.1",
      "canonical_id": "pkg:traitlets"
    }
  ],
  "depends_on": [],
  "evidence": {
    "recipes": [
      "specs/traitlets.json"
    ],
    "behavioral_spec": "zspecs/traitlets.zspec.zsdl",
    "recreation": "secondary"
  },
  "priority": {
    "primary": [
      "provenance",
      "tracking",
      "dependencies"
    ],
    "secondary": [
      "recreation"
    ]
  },
  "tracking": {
    "ingested_at": "2026-10-20T21:29:58+00:00",
    "recipe_count": 1,
    "maintainers": [
      "IPython Development Team <ipython-dev@python.org>"
    ],
    "categories": [
      "python"
    ],
    "source_paths": [
      "https://pypi.org/pypi/traitlets/json"
    ],
    "source_repo_commits": [],
    "build_systems": [
      "pypi"
    ],
    "distributions": [
      {
        "type": "sdist",
        "url": "https://files.pythonhosted.org/packages/2c/2e/a7fbfe268c8a3b32546930c0297c101d65a4a14c304ad5790a9f478f0e4e/traitlets-5.16.1.tar.gz",
        "sha256": "ed900c2b631aa3a112811139fa97b8d2c3bad5e989656bba4b7e52c7852c18c1"
      }
    ],
    "dropped_dependencies": [],
    "dep_edges": 0,
    "dep_resolved": 0,
    "dep_dangling": 0
  },
  "provenance": {
    "generated_by": "theseus.fabric",
    "imported_at": "2026-10-20T21:29:08+00:00",
    "confidence": 0.9,
    "sources": [
      {
        "path": "specs/traitlets.json",
        "kind": "package_recipe",
        "imported_at": "2026-10-20T21:29:08+00:00",
        "generated_by": "refresh_recipes.py",
        "source_path": "https://pypi.org/pypi/traitlets/json",
        "source_repo_commit": null,
        "confidence": 0.9,
        "unmapped": []
      }
    ],
    "warnings": [
      "Build requirements are unavailable from PyPI JSON metadata; no build dependencies inferred."
    ]
  }
}
